{
	"$schema": "../../schemas/plugin-build.schema.json",
	"id": "netsuite-ai-companion",
	"version": "1.0.0",
	"platform": "openai",
	"metadata": {
		"name": "netsuite-ai-companion",
		"description": "Guide AI assistants using NetSuite AI Connector.",
		"author": {
			"name": "Oracle NetSuite",
			"url": "https://www.netsuite.com"
		},
		"license": "The Universal Permissive License (UPL), Version 1.0",
		"keywords": [
			"netsuite",
			"aiconnector",
			"mcp"
		],
		"homepage": "https://github.com/oracle/netsuite-suitecloud-sdk/tree/ai-plugins-dist/openai/netsuite-ai-companion",
		"repository": "https://github.com/oracle/netsuite-suitecloud-sdk",
		"interface": {
			"displayName": "NetSuite AI Companion",
			"shortDescription": "Guide NetSuite AI Connector",
			"longDescription": "This plug-in guides AI assistants that use NetSuite AI Connector with the correct tool-selection order, output formatting, NetSuite domain knowledge, multiple-subsidiary and currency handling, and SuiteQL safety guardrails.",
			"developerName": "Oracle NetSuite",
			"category": "Business & Operations",
			"websiteURL": "https://github.com/oracle/netsuite-suitecloud-sdk/tree/ai-plugins-dist/openai/netsuite-ai-companion",
			"privacyPolicyURL": "https://github.com/oracle/netsuite-suitecloud-sdk/tree/ai-plugins-dist/openai/netsuite-ai-companion",
			"logo": "./assets/netsuite-logo.png",
			"composerIcon": "./assets/netsuite-icon.png",
			"brandColor": "#294B5F"
		}
	},
	"skills": [
		"netsuite-ai-connector-instructions"
	],
	"commonLayers": [
		"branding"
	],
	"inputs": [
		{
			"root": "src",
			"destination": ".",
			"include": [
				"README.md"
			],
			"exclude": []
		}
	]
}
