{
	"$schema": "../../schemas/plugin-build.schema.json",
	"id": "netsuite-finance-analyst",
	"version": "1.0.0",
	"platform": "anthropic",
	"metadata": {
		"name": "netsuite-finance-analyst",
		"description": "This plug-in provides Director-level finance analysis on live NetSuite data, including financial reporting, period-close activities, variance, aging, and reconciliation reviews, cash reporting, and board-ready financial narratives with clear next actions.",
		"author": {
			"name": "Oracle NetSuite",
			"url": "https://www.netsuite.com"
		},
		"license": "The Universal Permissive License (UPL), Version 1.0",
		"keywords": [
			"netsuite",
			"finance",
			"mcp"
		],
		"homepage": "https://github.com/oracle/netsuite-suitecloud-sdk/tree/ai-plugins-dist/anthropic/netsuite-finance-analyst",
		"repository": "https://github.com/oracle/netsuite-suitecloud-sdk",
		"category": "Productivity",
		"capabilities": [
			"Read"
		],
		"shortDescription": "Deliver Director-level finance analysis on live NetSuite data.",
		"longDescription": "This plug-in provides Director-level finance analysis on live NetSuite data, including financial reporting, period-close activities, variance, aging, and reconciliation reviews, cash reporting, and board-ready financial narratives with clear next actions."
	},
	"skills": [
		"netsuite-finance-analyst"
	],
	"commonLayers": [],
	"inputs": [
		{
			"root": "src",
			"destination": ".",
			"include": [
				"README.md"
			],
			"exclude": []
		}
	]
}